{
  "$schema": "https://json-schema.org/draft/2020-12/schema",
  "$id": "https://schemas.biblefi.io/tithe_transaction.schema.json",
  "title": "TitheTransaction",
  "description": "A record of a biblical giving transaction (tithe, offering, almsgiving, etc.) processed through the BibleFi protocol on Base chain. Fulfills Malachi 3:10: 'Bring the whole tithe into the storehouse.' Supports both manual and smart-contract-routed transactions.",
  "type": "object",
  "required": ["transaction_id","schema_version","sender_wallet","recipient_wallet","amount_wei","asset","chain_id","transaction_type","scripture_reference"],
  "additionalProperties": false,
  "properties": {
    "transaction_id": { "type": "string", "format": "uuid" },
    "schema_version": { "type": "string", "pattern": "^\\d+\\.\\d+\\.\\d+$", "examples": ["1.0.0"] },
    "sender_wallet": { "type": "string", "pattern": "^0x[0-9a-fA-F]{40}$", "description": "Wallet address of the giver" },
    "sender_user_id": { "type": "string", "format": "uuid", "description": "Links to user_profile record" },
    "sender_church_id": { "type": "string", "format": "uuid", "description": "Links to church_record if church-to-church tithe" },
    "recipient_wallet": { "type": "string", "pattern": "^0x[0-9a-fA-F]{40}$", "description": "Wallet of the recipient church, ministry, or protocol treasury" },
    "recipient_church_id": { "type": "string", "format": "uuid", "description": "Links to recipient church_record" },
    "amount_wei": { "type": "string", "pattern": "^\\d+$", "description": "Amount in wei (uint256 as string to avoid JavaScript precision loss). Convert: amount_wei / 10^decimals = token amount" },
    "amount_usd": { "type": "number", "minimum": 0, "description": "USD equivalent at time of transaction" },
    "asset": {
      "type": "object",
      "required": ["symbol", "contract_address", "chain_id", "decimals"],
      "additionalProperties": false,
      "properties": {
        "symbol": { "type": "string", "examples": ["USDC","ETH","WETH","BFI"] },
        "contract_address": { "type": "string", "pattern": "^0x[0-9a-fA-F]{40}$", "description": "Use zero address 0x0000000000000000000000000000000000000000 for native ETH" },
        "chain_id": { "type": "integer", "minimum": 1 },
        "decimals": { "type": "integer", "minimum": 0, "maximum": 18 },
        "coingecko_id": { "type": "string" }
      }
    },
    "chain_id": { "type": "integer", "minimum": 1, "description": "EVM chain ID. BibleFi primary chain = Base mainnet (8453)" },
    "tx_hash": { "type": "string", "pattern": "^0x[0-9a-fA-F]{64}$", "description": "On-chain transaction hash on Base chain" },
    "block_number": { "type": "integer", "minimum": 0 },
    "transaction_type": {
      "type": "string",
      "enum": ["tithe","firstfruits","offering","almsgiving","missions_gift","building_fund","emergency_relief","scholarship"],
      "description": "Biblical category of giving. tithe = 10% of income per Malachi 3:10. firstfruits = first portion per Proverbs 3:9-10. offering = freewill gift per 2 Corinthians 9:7."
    },
    "scripture_reference": {
      "type": "object",
      "required": ["book", "chapter", "verses"],
      "additionalProperties": false,
      "description": "Scripture backing this giving transaction. Recommended: Malachi 3:10 for tithes, Proverbs 3:9 for firstfruits, 2 Corinthians 9:7 for offerings, Luke 21:4 for widow's offering.",
      "properties": {
        "book": { "type": "string" },
        "chapter": { "type": "integer", "minimum": 1 },
        "verses": {
          "oneOf": [
            { "type": "integer", "minimum": 1 },
            { "type": "array", "items": { "type": "integer", "minimum": 1 }, "minItems": 1, "uniqueItems": true },
            { "type": "object", "required": ["from", "to"], "additionalProperties": false, "properties": { "from": { "type": "integer", "minimum": 1 }, "to": { "type": "integer", "minimum": 1 } } }
          ]
        },
        "notes": { "type": "string" }
      }
    },
    "percentage_of_income": { "type": "number", "minimum": 0, "maximum": 100, "description": "If provided, percentage of income this represents. 10.0 = traditional tithe per Malachi 3:10" },
    "is_recurring": { "type": "boolean", "default": false, "description": "Whether this is part of a recurring giving schedule" },
    "recurrence_interval": { "type": "string", "enum": ["weekly","biweekly","monthly","quarterly","annually"] },
    "giving_strategy_id": { "type": "string", "format": "uuid", "description": "Links to defi_strategy record if this tithe comes from yield generated by a BibleFi DeFi strategy" },
    "smart_contract_routed": { "type": "boolean", "default": false, "description": "Whether routed via BibleFi smart contract on Base chain" },
    "contract_address": { "type": "string", "pattern": "^0x[0-9a-fA-F]{40}$", "description": "BibleFi tithe router or splitter contract address on Base chain" },
    "attestation": {
      "type": "object",
      "additionalProperties": false,
      "required": ["chain_id", "contract_address", "attestation_type"],
      "description": "On-chain attestation record for this giving transaction. Use attestation_type: eas_attestation for EAS on Base chain.",
      "properties": {
        "chain_id": { "type": "integer", "minimum": 1 },
        "contract_address": { "type": "string", "pattern": "^0x[0-9a-fA-F]{40}$" },
        "token_id": { "type": "string" },
        "tx_hash": { "type": "string", "pattern": "^0x[0-9a-fA-F]{64}$" },
        "attestation_type": { "type": "string", "enum": ["nft_mint","eas_attestation","hypercert","poap","sbt","merkle_leaf","farcaster_frame","custom"] },
        "block_number": { "type": "integer", "minimum": 0 },
        "ipfs_cid": { "type": "string", "pattern": "^(Qm[1-9A-HJ-NP-Za-km-z]{44}|bafy[a-z2-7]{55})$" },
        "attested_at": { "type": "string", "format": "date-time" },
        "attested_by": { "type": "string" }
      }
    },
    "notes": { "type": "string" },
    "tags": { "type": "array", "uniqueItems": true, "items": { "type": "string" } },
    "created_at": { "type": "string", "format": "date-time" },
    "updated_at": { "type": "string", "format": "date-time" }
  }
}
